{
  "fixture_version": 1,
  "id": "stored_key_exact",
  "seed": "ssh-admission-v1",
  "endpoint_id": "fixture-endpoint-a",
  "profile_id": "fixture-profile-a",
  "stored_fingerprint": "SHA256:fixture-key-a",
  "presented_fingerprint": "SHA256:fixture-key-a",
  "credential": "fixture-credential-valid",
  "limits": { "channels": 4, "per_channel_bytes": 65536, "aggregate_bytes": 262144 },
  "expected": {
    "outcome": "ready",
    "ordered_events": ["transport_connected", "host_key_presented", "host_key_matched", "authentication_started", "authentication_succeeded", "ready"],
    "prohibited_before_outcome": ["trust_consent_required", "channel_opened"]
  },
  "steps": []
}
